{
  "schemaVersion": "1.0.0",
  "id": "variant-trace-span-outline-001",
  "conceptId": "si:trace-span",
  "variantType": "outline",
  "styleRecipeId": "si-outline-rounded-24",
  "svgPath": "outline.svg",
  "targetSizes": [
    16,
    20,
    24,
    32,
    48,
    128
  ],
  "strokeEditable": true,
  "qualityLevel": "L2 benchmark",
  "reviewState": "owner_review_required"
}
